{
  "cases": [
    {
      "decision": {
        "allowed": true,
        "checks": [
          "validity_window",
          "subject",
          "channel",
          "capability",
          "operation_binding",
          "repository_ref_path",
          "budgets",
          "claim_and_fence",
          "approval_gates"
        ],
        "contract_digest": "8ea8fd8307a5e05cb2c56e31a66edb6bb233a111c567cc72315a31219b14fe0a",
        "violations": []
      },
      "expected_outcome": "allow",
      "id": "allow-in-scope-edit",
      "observed_outcome": "allow",
      "passed": true
    },
    {
      "decision": {
        "allowed": true,
        "checks": [
          "validity_window",
          "subject",
          "channel",
          "capability",
          "operation_binding",
          "repository_ref_path",
          "budgets",
          "claim_and_fence",
          "approval_gates"
        ],
        "contract_digest": "8ea8fd8307a5e05cb2c56e31a66edb6bb233a111c567cc72315a31219b14fe0a",
        "violations": []
      },
      "expected_outcome": "allow",
      "id": "allow-at-not-before-boundary",
      "observed_outcome": "allow",
      "passed": true
    },
    {
      "decision": {
        "allowed": false,
        "checks": [
          "validity_window",
          "subject",
          "channel",
          "capability",
          "operation_binding",
          "repository_ref_path",
          "budgets",
          "claim_and_fence",
          "approval_gates"
        ],
        "contract_digest": "8ea8fd8307a5e05cb2c56e31a66edb6bb233a111c567cc72315a31219b14fe0a",
        "violations": [
          "contract has expired"
        ]
      },
      "expected_outcome": "deny",
      "id": "deny-at-expiry-boundary",
      "observed_outcome": "deny",
      "passed": true
    },
    {
      "decision": {
        "allowed": false,
        "checks": [
          "validity_window",
          "subject",
          "channel",
          "capability",
          "operation_binding",
          "repository_ref_path",
          "budgets",
          "claim_and_fence",
          "approval_gates"
        ],
        "contract_digest": "8ea8fd8307a5e05cb2c56e31a66edb6bb233a111c567cc72315a31219b14fe0a",
        "violations": [
          "capability 'teleport' is not granted"
        ]
      },
      "expected_outcome": "deny",
      "id": "deny-unknown-action",
      "observed_outcome": "deny",
      "passed": true
    },
    {
      "decision": {
        "allowed": false,
        "checks": [
          "validity_window",
          "subject",
          "channel",
          "capability",
          "operation_binding",
          "repository_ref_path",
          "budgets",
          "claim_and_fence",
          "approval_gates"
        ],
        "contract_digest": "8ea8fd8307a5e05cb2c56e31a66edb6bb233a111c567cc72315a31219b14fe0a",
        "violations": [
          "subject_id does not match the active contract"
        ]
      },
      "expected_outcome": "deny",
      "id": "deny-wrong-subject",
      "observed_outcome": "deny",
      "passed": true
    },
    {
      "decision": {
        "allowed": false,
        "checks": [
          "validity_window",
          "subject",
          "channel",
          "capability",
          "operation_binding",
          "repository_ref_path",
          "budgets",
          "claim_and_fence",
          "approval_gates"
        ],
        "contract_digest": "8ea8fd8307a5e05cb2c56e31a66edb6bb233a111c567cc72315a31219b14fe0a",
        "violations": [
          "channel 'other/work' is outside scope"
        ]
      },
      "expected_outcome": "deny",
      "id": "deny-wrong-channel",
      "observed_outcome": "deny",
      "passed": true
    },
    {
      "decision": {
        "allowed": false,
        "checks": [
          "validity_window",
          "subject",
          "channel",
          "capability",
          "operation_binding",
          "repository_ref_path",
          "budgets",
          "claim_and_fence",
          "approval_gates"
        ],
        "contract_digest": "8ea8fd8307a5e05cb2c56e31a66edb6bb233a111c567cc72315a31219b14fe0a",
        "violations": [
          "request.path must be a safe relative path"
        ]
      },
      "expected_outcome": "deny",
      "id": "deny-parent-traversal",
      "observed_outcome": "deny",
      "passed": true
    },
    {
      "decision": {
        "allowed": false,
        "checks": [
          "validity_window",
          "subject",
          "channel",
          "capability",
          "operation_binding",
          "repository_ref_path",
          "budgets",
          "claim_and_fence",
          "approval_gates"
        ],
        "contract_digest": "8ea8fd8307a5e05cb2c56e31a66edb6bb233a111c567cc72315a31219b14fe0a",
        "violations": [
          "request.path is required for read"
        ]
      },
      "expected_outcome": "deny",
      "id": "deny-read-without-path",
      "observed_outcome": "deny",
      "passed": true
    },
    {
      "decision": {
        "allowed": false,
        "checks": [
          "validity_window",
          "subject",
          "channel",
          "capability",
          "operation_binding",
          "repository_ref_path",
          "budgets",
          "claim_and_fence",
          "approval_gates"
        ],
        "contract_digest": "8ea8fd8307a5e05cb2c56e31a66edb6bb233a111c567cc72315a31219b14fe0a",
        "violations": [
          "request.path must be a safe relative path"
        ]
      },
      "expected_outcome": "deny",
      "id": "deny-windows-drive-path",
      "observed_outcome": "deny",
      "passed": true
    },
    {
      "decision": {
        "allowed": false,
        "checks": [
          "validity_window",
          "subject",
          "channel",
          "capability",
          "operation_binding",
          "repository_ref_path",
          "budgets",
          "claim_and_fence",
          "approval_gates"
        ],
        "contract_digest": "8ea8fd8307a5e05cb2c56e31a66edb6bb233a111c567cc72315a31219b14fe0a",
        "violations": [
          "request.path must be a safe relative path"
        ]
      },
      "expected_outcome": "deny",
      "id": "deny-windows-short-name-path",
      "observed_outcome": "deny",
      "passed": true
    },
    {
      "decision": {
        "allowed": false,
        "checks": [
          "validity_window",
          "subject",
          "channel",
          "capability",
          "operation_binding",
          "repository_ref_path",
          "budgets",
          "claim_and_fence",
          "approval_gates"
        ],
        "contract_digest": "636e4a2137313a7131cc5f1b3ec016ba6b7152564d928f83255bf52a0a9a3ca0",
        "violations": [
          "path 'src/permitmesh/policy.py' is outside allowed paths"
        ]
      },
      "expected_outcome": "deny",
      "id": "deny-single-segment-glob-descendant",
      "observed_outcome": "deny",
      "passed": true
    },
    {
      "decision": {
        "allowed": false,
        "checks": [
          "validity_window",
          "subject",
          "channel",
          "capability",
          "operation_binding",
          "repository_ref_path",
          "budgets",
          "claim_and_fence",
          "approval_gates"
        ],
        "contract_digest": "8ea8fd8307a5e05cb2c56e31a66edb6bb233a111c567cc72315a31219b14fe0a",
        "violations": [
          "request.operation is required for high-risk action 'deploy'",
          "request.operation_nonce must be 16-128 safe characters",
          "request.approvals must be a string array",
          "action 'deploy' requires 1 approval(s) from the configured approvers"
        ]
      },
      "expected_outcome": "deny",
      "id": "deny-malformed-approvals",
      "observed_outcome": "deny",
      "passed": true
    },
    {
      "decision": {
        "allowed": false,
        "checks": [
          "validity_window",
          "subject",
          "channel",
          "capability",
          "operation_binding",
          "repository_ref_path",
          "budgets",
          "claim_and_fence",
          "approval_gates"
        ],
        "contract_digest": "8ea8fd8307a5e05cb2c56e31a66edb6bb233a111c567cc72315a31219b14fe0a",
        "violations": [
          "claim_id does not match the active contract"
        ]
      },
      "expected_outcome": "deny",
      "id": "deny-stale-claim",
      "observed_outcome": "deny",
      "passed": true
    },
    {
      "decision": {
        "allowed": false,
        "checks": [
          "validity_window",
          "subject",
          "channel",
          "capability",
          "operation_binding",
          "repository_ref_path",
          "budgets",
          "claim_and_fence",
          "approval_gates"
        ],
        "contract_digest": "8ea8fd8307a5e05cb2c56e31a66edb6bb233a111c567cc72315a31219b14fe0a",
        "violations": [
          "fencing_generation does not match the active contract"
        ]
      },
      "expected_outcome": "deny",
      "id": "deny-stale-fence",
      "observed_outcome": "deny",
      "passed": true
    },
    {
      "decision": {
        "allowed": false,
        "checks": [
          "validity_window",
          "subject",
          "channel",
          "capability",
          "operation_binding",
          "repository_ref_path",
          "budgets",
          "claim_and_fence",
          "approval_gates"
        ],
        "contract_digest": "8ea8fd8307a5e05cb2c56e31a66edb6bb233a111c567cc72315a31219b14fe0a",
        "violations": [
          "request.files_changed=21 exceeds max_files_changed=20",
          "request.commands_used=101 exceeds max_commands=100",
          "request.cost_usd=25.01 exceeds max_cost_usd=25"
        ]
      },
      "expected_outcome": "deny",
      "id": "deny-exceeded-budgets",
      "observed_outcome": "deny",
      "passed": true
    },
    {
      "decision": {
        "allowed": false,
        "checks": [